18:37:40.701770 IP 10.10.0.2.47455 > 10.40.0.2.9: Flags [S], seq 1192593265, win 14600, options [mss 1460,sackOK,TS val 607260 ecr 0,nop,wscale 2], length 0
18:37:41.695536 IP 10.10.0.2.47455 > 10.40.0.2.9: Flags [S], seq 1192593265, win 14600, options [mss 1460,sackOK,TS val 607360 ecr 0,nop,wscale 2], length 0
18:37:41.705908 IP 10.40.0.2.9 > 10.10.0.2.47455: Flags [S.], seq 3843955545, ack 1192593266, win 14480, options [mss 1460,sackOK,TS val 555707 ecr 607260,nop,wscale 2], length 0
18:37:41.706041 IP 10.10.0.2.47455 > 10.40.0.2.9: Flags [.], ack 1, win 3650, options [nop,nop,TS val 607361 ecr 555707], length 0
18:37:41.706085 IP 10.10.0.2.47455 > 10.40.0.2.9: Flags [P.], seq 1:101, ack 1, win 3650, options [nop,nop,TS val 607361 ecr 555707], length 100
18:37:41.716291 IP 10.10.0.2.47455 > 10.40.0.2.9: Flags [P.], seq 101:201, ack 1, win 3650, options [nop,nop,TS val 607362 ecr 555707], length 100
18:37:41.730083 IP 10.10.0.2.47455 > 10.40.0.2.9: Flags [P.], seq 201:301, ack 1, win 3650, options [nop,nop,TS val 607363 ecr 555707], length 100
18:37:41.740655 IP 10.10.0.2.47455 > 10.40.0.2.9: Flags [P.], seq 301:401, ack 1, win 3650, options [nop,nop,TS val 607364 ecr 555707], length 100
18:37:41.754269 IP 10.10.0.2.47455 > 10.40.0.2.9: Flags [P.], seq 401:501, ack 1, win 3650, options [nop,nop,TS val 607366 ecr 555707], length 100
18:37:41.764533 IP 10.10.0.2.47455 > 10.40.0.2.9: Flags [P.], seq 501:601, ack 1, win 3650, options [nop,nop,TS val 607367 ecr 555707], length 100
18:37:41.775037 IP 10.10.0.2.47455 > 10.40.0.2.9: Flags [P.], seq 601:701, ack 1, win 3650, options [nop,nop,TS val 607368 ecr 555707], length 100
18:37:41.785294 IP 10.10.0.2.47455 > 10.40.0.2.9: Flags [P.], seq 701:801, ack 1, win 3650, options [nop,nop,TS val 607369 ecr 555707], length 100
18:37:41.795386 IP 10.10.0.2.47455 > 10.40.0.2.9: Flags [P.], seq 801:901, ack 1, win 3650, options [nop,nop,TS val 607370 ecr 555707], length 100
18:37:41.805542 IP 10.10.0.2.47455 > 10.40.0.2.9: Flags [P.], seq 901:1001, ack 1, win 3650, options [nop,nop,TS val 607371 ecr 555707], length 100
18:37:42.703638 IP 10.40.0.2.9 > 10.10.0.2.47455: Flags [S.], seq 3843955545, ack 1192593266, win 14480, options [mss 1460,sackOK,TS val 555807 ecr 607260,nop,wscale 2], length 0
18:37:42.703662 IP 10.40.0.2.9 > 10.10.0.2.47455: Flags [S.], seq 3843955545, ack 1192593266, win 14480, options [mss 1460,sackOK,TS val 555807 ecr 607260,nop,wscale 2], length 0
18:37:42.703931 IP 10.10.0.2.47455 > 10.40.0.2.9: Flags [.], ack 1, win 3650, options [nop,nop,TS val 607461 ecr 555707], length 0
18:37:42.703951 IP 10.10.0.2.47455 > 10.40.0.2.9: Flags [.], ack 1, win 3650, options [nop,nop,TS val 607461 ecr 555707], length 0
18:37:42.714354 IP 10.40.0.2.9 > 10.10.0.2.47455: Flags [.], ack 101, win 3620, options [nop,nop,TS val 555808 ecr 607361], length 0
18:37:42.714617 IP 10.10.0.2.47455 > 10.40.0.2.9: Flags [P.], seq 1001:1101, ack 1, win 3650, options [nop,nop,TS val 607462 ecr 555808], length 100
18:37:42.725324 IP 10.40.0.2.9 > 10.10.0.2.47455: Flags [.], ack 201, win 3620, options [nop,nop,TS val 555809 ecr 607362], length 0
18:37:42.725404 IP 10.10.0.2.47455 > 10.40.0.2.9: Flags [P.], seq 1101:1201, ack 1, win 3650, options [nop,nop,TS val 607463 ecr 555808], length 100
18:37:42.735929 IP 10.10.0.2.47455 > 10.40.0.2.9: Flags [P.], seq 1201:1301, ack 1, win 3650, options [nop,nop,TS val 607464 ecr 555809], length 100
18:37:42.735954 IP 10.40.0.2.9 > 10.10.0.2.47455: Flags [.], ack 301, win 3620, options [nop,nop,TS val 555810 ecr 607363], length 0
18:37:42.752401 IP 10.40.0.2.9 > 10.10.0.2.47455: Flags [.], ack 401, win 3620, options [nop,nop,TS val 555811 ecr 607364], length 0
18:37:42.752479 IP 10.10.0.2.47455 > 10.40.0.2.9: Flags [P.], seq 1301:1401, ack 1, win 3650, options [nop,nop,TS val 607466 ecr 555810], length 100
18:37:42.771062 IP 10.40.0.2.9 > 10.10.0.2.47455: Flags [.], ack 501, win 3620, options [nop,nop,TS val 555813 ecr 607366], length 0
18:37:42.771073 IP 10.40.0.2.9 > 10.10.0.2.47455: Flags [.], ack 601, win 3620, options [nop,nop,TS val 555814 ecr 607367], length 0
18:37:42.771145 IP 10.10.0.2.47455 > 10.40.0.2.9: Flags [P.], seq 1401:1501, ack 1, win 3650, options [nop,nop,TS val 607467 ecr 555811], length 100
18:37:42.789757 IP 10.40.0.2.9 > 10.10.0.2.47455: Flags [.], ack 701, win 3620, options [nop,nop,TS val 555815 ecr 607368], length 0
18:37:42.789767 IP 10.40.0.2.9 > 10.10.0.2.47455: Flags [.], ack 801, win 3620, options [nop,nop,TS val 555816 ecr 607369], length 0
18:37:42.789776 IP 10.10.0.2.47455 > 10.40.0.2.9: Flags [P.], seq 1501:1601, ack 1, win 3650, options [nop,nop,TS val 607469 ecr 555814], length 100
18:37:42.804441 IP 10.40.0.2.9 > 10.10.0.2.47455: Flags [.], ack 901, win 3620, options [nop,nop,TS val 555817 ecr 607370], length 0
18:37:42.804457 IP 10.10.0.2.47455 > 10.40.0.2.9: Flags [P.], seq 1601:1701, ack 1, win 3650, options [nop,nop,TS val 607471 ecr 555816], length 100
18:37:42.814813 IP 10.10.0.2.47455 > 10.40.0.2.9: Flags [P.], seq 1701:1801, ack 1, win 3650, options [nop,nop,TS val 607472 ecr 555817], length 100
18:37:42.814906 IP 10.40.0.2.9 > 10.10.0.2.47455: Flags [.], ack 1001, win 3620, options [nop,nop,TS val 555818 ecr 607371], length 0
18:37:42.825292 IP 10.10.0.2.47455 > 10.40.0.2.9: Flags [P.], seq 1801:1901, ack 1, win 3650, options [nop,nop,TS val 607473 ecr 555818], length 100
18:37:42.835466 IP 10.10.0.2.47455 > 10.40.0.2.9: Flags [P.], seq 1901:2001, ack 1, win 3650, options [nop,nop,TS val 607474 ecr 555818], length 100
18:37:42.845763 IP 10.10.0.2.47455 > 10.40.0.2.9: Flags [P.], seq 2001:2101, ack 1, win 3650, options [nop,nop,TS val 607475 ecr 555818], length 100
18:37:42.855941 IP 10.10.0.2.47455 > 10.40.0.2.9: Flags [P.], seq 2101:2201, ack 1, win 3650, options [nop,nop,TS val 607476 ecr 555818], length 100
18:37:42.866165 IP 10.10.0.2.47455 > 10.40.0.2.9: Flags [P.], seq 2201:2301, ack 1, win 3650, options [nop,nop,TS val 607477 ecr 555818], length 100
18:37:42.876438 IP 10.10.0.2.47455 > 10.40.0.2.9: Flags [P.], seq 2301:2401, ack 1, win 3650, options [nop,nop,TS val 607478 ecr 555818], length 100
18:37:42.886716 IP 10.10.0.2.47455 > 10.40.0.2.9: Flags [P.], seq 2401:2501, ack 1, win 3650, options [nop,nop,TS val 607479 ecr 555818], length 100
18:37:43.716458 IP 10.40.0.2.9 > 10.10.0.2.47455: Flags [.], ack 1101, win 3620, options [nop,nop,TS val 555909 ecr 607462], length 0
18:37:43.716614 IP 10.10.0.2.47455 > 10.40.0.2.9: Flags [.], seq 2501:3949, ack 1, win 3650, options [nop,nop,TS val 607562 ecr 555909], length 1448
18:37:43.716624 IP 10.10.0.2.47455 > 10.40.0.2.9: Flags [.], seq 3949:5397, ack 1, win 3650, options [nop,nop,TS val 607562 ecr 555909], length 1448
18:37:43.727165 IP 10.40.0.2.9 > 10.10.0.2.47455: Flags [.], ack 1201, win 3620, options [nop,nop,TS val 555910 ecr 607463], length 0
18:37:43.727314 IP 10.10.0.2.47455 > 10.40.0.2.9: Flags [.], seq 5397:6845, ack 1, win 3650, options [nop,nop,TS val 607563 ecr 555910], length 1448
18:37:43.727321 IP 10.10.0.2.47455 > 10.40.0.2.9: Flags [.], seq 6845:8293, ack 1, win 3650, options [nop,nop,TS val 607563 ecr 555910], length 1448
18:37:43.737583 IP 10.40.0.2.9 > 10.10.0.2.47455: Flags [.], ack 1301, win 3620, options [nop,nop,TS val 555911 ecr 607464], length 0
18:37:43.737729 IP 10.10.0.2.47455 > 10.40.0.2.9: Flags [.], seq 8293:9741, ack 1, win 3650, options [nop,nop,TS val 607564 ecr 555911], length 1448
18:37:43.737738 IP 10.10.0.2.47455 > 10.40.0.2.9: Flags [FP.], seq 9741:10001, ack 1, win 3650, options [nop,nop,TS val 607564 ecr 555911], length 260
