IP 10.10.0.1.47455 > 10.10.1.1.discard: Flags [S], seq 2441485168, win 14600, options [mss 1366,sackOK,TS val 99584 ecr 0,nop,wscale 2], length 0
IP 10.10.1.1.discard > 10.10.0.1.47455: Flags [S.], seq 1813486520, ack 2441485169, win 14480, options [mss 1460,sackOK,TS val 126938 ecr 99584,nop,wscale 2], length 0
IP 10.10.0.1.47455 > 10.10.1.1.discard: Flags [.], ack 1, win 3650, options [nop,nop,TS val 99586 ecr 126938], length 0
IP 172.16.1.3.60625 > 192.168.1.1.domain: 54778+ PTR? 3.1.16.172.in-addr.arpa. (41)
IP 10.10.0.1.route > 224.0.0.9.route: RIPv2, Response, length: 44
IP 10.10.0.1.47455 > 10.10.1.1.discard: Flags [P.], seq 1:4, ack 1, win 3650, options [nop,nop,TS val 99729 ecr 126938], length 3
IP 10.10.1.1.discard > 10.10.0.1.47455: Flags [.], ack 4, win 3620, options [nop,nop,TS val 127081 ecr 99729], length 0
IP 10.10.0.1.47455 > 10.10.1.1.discard: Flags [P.], seq 4:7, ack 1, win 3650, options [nop,nop,TS val 99762 ecr 127081], length 3
IP 10.10.1.1.discard > 10.10.0.1.47455: Flags [.], ack 7, win 3620, options [nop,nop,TS val 127114 ecr 99762], length 0
IP 10.10.0.1.47455 > 10.10.1.1.discard: Flags [P.], seq 7:10, ack 1, win 3650, options [nop,nop,TS val 99790 ecr 127114], length 3
IP 10.10.1.1.discard > 10.10.0.1.47455: Flags [.], ack 10, win 3620, options [nop,nop,TS val 127142 ecr 99790], length 0
IP 10.10.0.1.47455 > 10.10.1.1.discard: Flags [F.], seq 10, ack 1, win 3650, options [nop,nop,TS val 100040 ecr 127142], length 0
IP 10.10.1.1.discard > 10.10.0.1.47455: Flags [F.], seq 1, ack 11, win 3620, options [nop,nop,TS val 127392 ecr 100040], length 0
