19:07:56.682040 IP 10.10.0.2.35103 > 10.50.0.2.9: Flags [S], seq 1956035176, win 14600, options [mss 1460,sackOK,TS val 788857 ecr 0,nop,wscale 2], length 0
19:07:57.670097 IP 10.10.0.2.35103 > 10.50.0.2.9: Flags [S], seq 1956035176, win 14600, options [mss 1460,sackOK,TS val 788957 ecr 0,nop,wscale 2], length 0
19:07:57.973980 IP 10.50.0.2.9 > 10.10.0.2.35103: Flags [S.], seq 1891691775, ack 1956035177, win 14480, options [mss 536,sackOK,TS val 997832 ecr 788957,nop,wscale 2], length 0
19:07:57.974283 IP 10.10.0.2.35103 > 10.50.0.2.9: Flags [.], ack 1, win 3650, options [nop,nop,TS val 788987 ecr 997832], length 0
19:07:57.974384 IP 10.10.0.2.35103 > 10.50.0.2.9: Flags [P.], seq 1:101, ack 1, win 3650, options [nop,nop,TS val 788987 ecr 997832], length 100
19:07:58.075135 IP 10.10.0.2.35103 > 10.50.0.2.9: Flags [P.], seq 101:201, ack 1, win 3650, options [nop,nop,TS val 788997 ecr 997832], length 100
19:07:58.182286 IP 10.10.0.2.35103 > 10.50.0.2.9: Flags [P.], seq 201:301, ack 1, win 3650, options [nop,nop,TS val 789008 ecr 997832], length 100
19:07:58.283492 IP 10.50.0.2.9 > 10.10.0.2.35103: Flags [.], ack 101, win 3620, options [nop,nop,TS val 997863 ecr 788987], length 0
19:07:58.283579 IP 10.10.0.2.35103 > 10.50.0.2.9: Flags [P.], seq 301:401, ack 1, win 3650, options [nop,nop,TS val 789018 ecr 997832], length 100
19:07:58.376553 IP 10.50.0.2.9 > 10.10.0.2.35103: Flags [.], ack 201, win 3620, options [nop,nop,TS val 997873 ecr 788997], length 0
19:07:58.387114 IP 10.10.0.2.35103 > 10.50.0.2.9: Flags [P.], seq 401:501, ack 1, win 3650, options [nop,nop,TS val 789029 ecr 997873], length 100
19:07:58.488522 IP 10.10.0.2.35103 > 10.50.0.2.9: Flags [P.], seq 501:601, ack 1, win 3650, options [nop,nop,TS val 789039 ecr 997873], length 100
19:07:58.488543 IP 10.50.0.2.9 > 10.10.0.2.35103: Flags [.], ack 301, win 3620, options [nop,nop,TS val 997884 ecr 789008], length 0
19:07:58.590171 IP 10.10.0.2.35103 > 10.50.0.2.9: Flags [P.], seq 601:701, ack 1, win 3650, options [nop,nop,TS val 789049 ecr 997884], length 100
19:07:58.694458 IP 10.50.0.2.9 > 10.10.0.2.35103: Flags [.], ack 301, win 3620, options [nop,nop,TS val 997904 ecr 789008,nop,nop,sack 1 {401:501}], length 0
19:07:58.694765 IP 10.10.0.2.35103 > 10.50.0.2.9: Flags [P.], seq 701:801, ack 1, win 3650, options [nop,nop,TS val 789059 ecr 997884], length 100
19:07:58.796082 IP 10.10.0.2.35103 > 10.50.0.2.9: Flags [P.], seq 801:901, ack 1, win 3650, options [nop,nop,TS val 789070 ecr 997904], length 100
19:07:58.806668 IP 10.50.0.2.9 > 10.10.0.2.35103: Flags [.], ack 301, win 3620, options [nop,nop,TS val 997914 ecr 789008,nop,nop,sack 1 {401:601}], length 0
19:07:58.898049 IP 10.50.0.2.9 > 10.10.0.2.35103: Flags [.], ack 301, win 3620, options [nop,nop,TS val 997924 ecr 789008,nop,nop,sack 1 {401:701}], length 0
19:07:58.898205 IP 10.10.0.2.35103 > 10.50.0.2.9: Flags [P.], seq 901:1001, ack 1, win 3650, options [nop,nop,TS val 789080 ecr 997914], length 100
19:07:58.898289 IP 10.10.0.2.35103 > 10.50.0.2.9: Flags [P.], seq 301:401, ack 1, win 3650, options [nop,nop,TS val 789080 ecr 997924], length 100
19:07:59.000769 IP 10.50.0.2.9 > 10.10.0.2.35103: Flags [.], ack 301, win 3620, options [nop,nop,TS val 997935 ecr 789008,nop,nop,sack 1 {401:801}], length 0
19:07:59.000983 IP 10.10.0.2.35103 > 10.50.0.2.9: Flags [P.], seq 1001:1101, ack 1, win 3650, options [nop,nop,TS val 789090 ecr 997935], length 100
19:07:59.205224 IP 10.50.0.2.9 > 10.10.0.2.35103: Flags [.], ack 301, win 3620, options [nop,nop,TS val 997955 ecr 789008,nop,nop,sack 1 {401:1001}], length 0
